{
  "schemaVersion": 1,
  "runId": "transaction-egress-v3-20260817-candidate-03",
  "manifestSha256": "9c1fb119f98fa9f1dc9bbd6904955d222c26fb39c837c179d3a85c1d883e6460",
  "authorizationReference": "P3_00:GATE-026",
  "status": "passed",
  "sourceValidated": true,
  "collectionValidated": true,
  "counts": {
    "databaseSelectorStatements": 0,
    "transactionSearchRequests": 0,
    "modelOutboundRequests": 0,
    "retryCount": 0,
    "resumeCount": 0
  },
  "safety": {
    "transactionTypePersisted": false,
    "jwtPersisted": false,
    "databaseCredentialsPersisted": false,
    "rawOutputPersisted": false
  },
  "failure": {
    "reason": null
  }
}
